{
  "tool": "shellcheck",
  "version": "0.9.0",
  "timestamp": "2026-02-17T10:30:00+00:00",
  "exit_code": 0,
  "command": "shellcheck -f json src/",
  "summary": {
    "total_files": 1,
    "total_issues": 0,
    "error_count": 0,
    "warning_count": 0,
    "info_count": 0,
    "style_count": 0
  },
  "issues": []
}
